n_total,acad_year,season,n_in_acad_year,date,year,title,contributors_1,institutions_1,contributors_2,institutions_2,contributors_3,institutions_3,contributors_4,institutions_4,contributors_5,institutions_5,contributors_6,institutions_6,contributors_7,institutions_7,themes_1,themes_2,themes_3,themes_4,themes_5,themes_6,themes_7
189,2020-2021,Summer,19,2021-04-15,2021,Introduction,Monica Berti,University of Leipzig,Gabriel Bodard,Institute of Classical Studies (London),Valeria Vitale,King's College London,,,,,,,,,,,,,,,
190,2020-2021,Summer,20,2021-04-22,2021,Teaching Epigraphy in a Pandemic,Alice Bencivenni,University of Bologna,Gabriel Bodard,Institute of Classical Studies (London),Irene Vagionakis,University of Bologna,,,,,,,,,Epigraphy and Paleography,"Text Encoding and Markup Language Creation, Deployment, and Analysis",Classical Studies,"Digitisation, Resource Creation, and Discovery",Public Humanities and Community Engaged Scholarship,,
191,2020-2021,Summer,21,2021-04-29,2021,Digital Epigraphic Corpora. The Example of the Inscriptions from Israel and Palestine,Michael Satlow,Brown University,Elli Mylonas,Brown University,,,,,,,,,,,Epigraphy and Paleography,"Text Encoding and Markup Language Creation, Deployment, and Analysis",Corpora and Corpus Activities,"Digitisation, Resource Creation, and Discovery",Public Humanities and Community Engaged Scholarship,,
192,2020-2021,Summer,22,2021-05-06,2021,Linguistic Annotations of Greek and Latin Inscriptions,Francesca Dell'Oro,University of Lausanne,,,,,,,,,,,,,"Annotation Structures, Systems, and Methods",Classical Studies,Corpora and Corpus Activities,Linguistics,Data Models and Formal Languages,,
193,2020-2021,Summer,23,2021-05-20,2021,Learning and Reading ancient Greek with Pedalion,Toon van Haal,Katholieke Universiteit Leuven,Alek Keersmaekers,Katholieke Universiteit Leuven,,,,,,,,,,,Classical Studies,Linguistics,Teaching and Pedagogy,Digital Humanities - Multilinguality,Morphology,,
194,2020-2021,Summer,24,2021-05-27,2021,Reading and Learning ancient Greek with Diorisis and the Scaife Viewer,James Tauber,Eldarion,Alessandro Vatri,University of Oxford,,,,,,,,,,,Classical Studies,Linguistics,Teaching and Pedagogy,Digital Humanities - Multilinguality,Visualization,,
195,2020-2021,Summer,25,2021-06-03,2021,Trismegistos People,Yanne Broux,University of Bordeaux,,,,,,,,,,,,,"Digital Biography, Personography, and Prosopography",Corpora and Corpus Activities,Classical Studies,Interdisciplinary Collaboration,Historical Studies,,
196,2020-2021,Summer,26,2021-06-10,2021,Named Entity Recognition and Prosopography,Monica Berti,University of Leipzig,Gabriel Bodard,Institute of Classical Studies (London),,,,,,,,,,,"Digital Biography, Personography, and Prosopography",Historical Studies,Natural Language Processing,Corpus and Text Analysis,Digital Humanities - Multilinguality,,
197,2020-2021,Summer,27,2021-06-17,2021,Annotating Geographical Data with Recogito,Elton Barker,Open University,Valeria Vitale,King's College London,,,,,,,,,,,"Annotation Structures, Systems, and Methods",Geohumanities,Geography and Geo-humanities,"Spatial & Spatio-temporal Analysis, Modeling and Visualization",Linking and Annotation,,
198,2020-2021,Summer,28,2021-06-24,2021,Citation for Historical Texts and the Cited Loci Project,Matteo Romanello,École polytechnique fédérale de Lausanne,,,,,,,,,,,,,Historical Studies,Concording and Indexing,"Annotation Structures, Systems, and Methods",Corpora and Corpus Activities,Publishing and Delivery Systems,,
199,2020-2021,Summer,29,2021-07-01,2021,The Digital Latin Library,Samuel J. Huskey,The University of Oklahoma,,,,,,,,,,,,,"Digital Libraries Creation, Management, and Analysis","Database Creation, Management, and Analysis","Metadata Standards, Systems, and Methods",Linked (open) Data,"Scholarly Editing and Editions Development, Analysis, and Methods",,
200,2020-2021,Summer,30,2021-07-08,2021,eAQUA. Extraction of structured knowledge from ancient sources for Classical Studies,Corina Willkommen,University of Leipzig,Jens Wittig,University of Leipzig,,,,,,,,,,,Digital Textualities,Classical Studies,"Annotation Structures, Systems, and Methods",Data Modeling and Architecture Including Hypothesis-driven Modeling,Data Mining / Text Mining,,
201,2020-2021,Summer,31,2021-07-15,2021,Beyond Classics: The Book of the Dead in 3D,Rita Lucarelli,University of California (Berkeley),Franziska Naether,University of Leipzig,,,,,,,,,,,Classical Studies,Digitization (2d & 3d),3d/4d Modeling,"3d Printing, Critical Making",Visualization,,
202,2020-2021,Summer,32,2021-07-22,2021,Beyond Classics: The Turin Papyrus Online Platform (TPOP),Susanne Töpfer,Fondazione Museo delle Antichità Egizie di Torino,Franziska Naether,University of Leipzig,,,,,,,,,,,Classical Studies,Digitization (2d & 3d),Visualization,Electronic Literature and Digital Arts,"Data, Object, and Artefact Preservation",,
203,2021-2022,Fall,1,2021-10-07,2021,Philological Search Tools,Gabriel Bodard,University of London,Peter Heslin,Durham,Alek Keersmaekers,Katholieke Universiteit Leuven,James Tauber,Eldarion,,,,,,,,,,,,,
204,2021-2022,Fall,2,2021-10-14,2021,Text Encoding I: EpiDoc,Gabriel Bodard,University of London,Polina Yordanova,Helsinki,,,,,,,,,,,,,,,,,
205,2021-2022,Fall,3,2021-10-21,2021,Text Analysis with Voyant,Aurélien Berra,Université Paris-Nanterre,Gabriel Bodard,University of London,Christopher Ohge,University of London,,,,,,,,,,,,,,,
206,2021-2022,Fall,4,2021-10-28,2021,Text Encoding II: Objects,Gabriel Bodard,University of London,Scott DiGiulio,Mississippi State,,,,,,,,,,,,,,,,,
207,2021-2022,Fall,5,2021-11-04,2021,Research with Treebanks,Nicole Iu,University of London,Francesco Mambrini,Milan,Marja Vierros,University of Helsinki,,,,,,,,,,,,,,,
208,2021-2022,Fall,6,2021-11-11,2021,cancelled,,,,,,,,,,,,,,,,,,,,,
209,2021-2022,Fall,7,2021-11-18,2021,Translation and Text Alignment,Chiara Palladino,Furman,Farnoosh Shamsian,Leipzig,Maia Shukhosvili,Tbilisi,,,,,,,,,,,,,,,
210,2021-2022,Fall,8,2021-11-25,2021,Text and Web Annotation,Monica Berti,Leipzig,Valeria Vitale,Alan Turing Institute,,,,,,,,,,,,,,,,,
211,2021-2022,Fall,9,2021-12-02,2021,Computational Linguistics,Alek Keersmaekers,Katholieke Universiteit Leuven,Martina Astrid Rodda,Oxford University,,,,,,,,,,,,,,,,,
212,2021-2022,Spring,10,2022-01-13,2022,Crowdsourcing and cultural heritage,Gabriel Bodard,University of London,Richard Nevell,Wikimedia UK,John Pearce,KCL,,,,,,,,,,,,,,,
213,2021-2022,Spring,11,2022-01-20,2022,"Museum data, access and metadata",Paula Granados García,British Museum,Susanne Töpfer,Museo Egizio Torino,,,,,,,,,,,,,,,,,
214,2021-2022,Spring,12,2022-01-27,2022,3D imaging in museum research,Gabriel Bodard,University of London,Daniel O'Flynn,British Museum,Dan Pett,Cambridge,,,,,,,,,,,,,,,
215,2021-2022,Spring,13,2022-02-03,2022,Digital heritage collections,Paula Granados García,British Museum,Rhiannon Lewis,University of London & Science Museums Group,Stella Wisdom,British Library,,,,,,,,,,,,,,,
216,2021-2022,Spring,14,2022-02-10,2022,3D modelling and reconstruction,Orly Lewis,Hebrew University of Jerusalem,Tosca Lynch,University of Oxford,Gabriel Bodard,University of London,,,,,,,,,,,,,,,
217,2021-2022,Spring,15,2022-02-17,2022,Linked geographical data and annotation,Paula Granados García,British Museum,Valeria Vitale,Alan Turing Institute,,,,,,,,,,,,,,,,,
218,2021-2022,Spring,16,2022-02-24,2022,Reuse of heritage data and open licenses,Douglas McCarthy,Europeana Foundation,Andrea Wallace,University of Exter UK,,,,,,,,,,,,,,,,,
219,2021-2022,Spring,17,2022-03-03,2022,Geographic Information Systems,Sarah Murray,Toronto,Rebecca Seifried,UMass Amherst,,,,,,,,,,,,,,,,,
220,2021-2022,Spring,18,2022-03-10,2022,"Archaeology, VR and other gaming technologies",Coré Ferrer-Alcantud,Universitat Jaume I,Andrew Reinhard,New York University,,,,,,,,,,,,,,,,,
